key,english,context
free_user_ai_restriction,Not available on the free plan. Upgrade to access AI features.,free user ai restriction
free_user_monitoring_limit,Free plan users can only create one monitoring,Monitoring restrictions
free_user_assessment_type_limit,Free plan users can only create one assessment of each type,Assessment restrictions
free_user_cannot_import,Monitoring import is not available on the free plan,free_user_cannot_import
free_user_cannot_copy,Copy is not available on the free plan,free_user_cannot_copy