key,english,context
quota_dialog_trial_title,Your trial has ended,Title of the dialog shown when the 14-day trial expires
quota_dialog_trial_body,Upgrade to a paid plan to keep using AI features.,Body text of the trial expired dialog
quota_dialog_quota_title,Monthly AI limit reached,Title of the dialog shown when the quota is exceeded
quota_dialog_quota_body,You've used all your AI calls for this month. Upgrade or wait until next month.,Body text of the quota exceeded dialog
quota_dialog_dismiss,Not now,Dismiss button in the AI quota dialog
quota_dialog_upgrade,See plans,Upgrade CTA button in the AI quota dialog
